;TrV;Benämning;Definition;Synonym
Grundfunktioner och Komponenter;HJA;Gjutverktyg;primärformande objekt från materia i flytande tillstånd;3D-printer
Grundfunktioner och Komponenter;HJB;Press;primärformande objekt från solid materia i fast tillstånd;3D-printer, pulverpress, spånpress
Grundfunktioner och Komponenter;HK;Ytbehandlande objekt;materialbehandlande objekt genom ytskydd;
Grundfunktioner och Komponenter;HKA;Ytrengörare;ytbehandlande objekt genom preparation;autoklav, desinficeringsmaskin, diskmaskin, högtryckstvätt, sköljmaskin, tvättmaskin, ultraljudsrengörare, ångtvätt
Grundfunktioner och Komponenter;HKB;Ytmodifierare;ytbehandlande objekt genom modifiering;blästringsmaskin, polermaskin, slipmaskin
Grundfunktioner och Komponenter;HKC;Yttäckningsmaskin;ytbehandlande objekt genom täckning;anodiseringsmaskin, sprutmålningsaggregat
Grundfunktioner och Komponenter;HL;Ihopsättande objekt;materialbehandlande objekt genom ihopfogning eller ihopsättning;
Grundfunktioner och Komponenter;HLA;Monteringsrobot;ihopsättande objekt genom fysisk ihopsättning;industrirobot, monteringsmaskin
Grundfunktioner och Komponenter;HLB;Mekanisk ihopfogningsmaskin;ihopsättande objekt genom mekanisk ihopfogning;crimpningsmaskin, falsmaskin, friktionssvets, sickmaskin, sickningsmaskin, trycksvetsmaskin, vikmaskin
Grundfunktioner och Komponenter;HLC;Smältsvets ;ihopsättande objekt genom termisk ihopfogning;argonsvets, bågsvets, gassvets, gasvolframsvets, lasersvets, lödningsmaskin, mag-svets, metallbågsvets, mig-svets, mig/mag-svets, mma-svets, plasmasvets, punktsvets, skyddsgassvets, svetsrobot, tig-svets, ultrasvets
Grundfunktioner och Komponenter;HLD;Limningsmaskin;ihopsättande objekt genom kemisk ihopfogning;
Grundfunktioner och Komponenter;HM;Kraftbaserat separerande objekt;materialbehandlande objekt genom separation av blandande substanser genom kraft;
Grundfunktioner och Komponenter;HMA;Avskiljare;kraftbaserat separerande objekt av partiklar genom gravitation;fettavskiljare, gipsavskiljare, kammarbrunn, oljeavskiljare, sandfång, sedimentationstank, slamavskiljare
Grundfunktioner och Komponenter;HMB;Centrifug;kraftbaserat separerande objekt av substanser genom centrifugalkraft i en roterande kammare;
Grundfunktioner och Komponenter;HMC;Cyklon;kraftbaserat separerande objekt av substanser genom rotation i en stationär kammare;hydrocyklon
Grundfunktioner och Komponenter;HP;Termiskt separerande objekt;materialbehandlande objekt genom termisk separation av blandade substanser;
Grundfunktioner och Komponenter;HPA;Avfuktare;termiskt separerande objekt som avlägsnar fukt;luftavfuktare, torktumlare, torkskåp
Grundfunktioner och Komponenter;HPB;Destillator;termiskt separerande objekt som genererar gas från en vätska;
Grundfunktioner och Komponenter;HQ;Mekaniskt separerande objekt;materialbehandlande objekt genom mekanisk separation av blandade substanser;
Grundfunktioner och Komponenter;HQA;Filter;mekaniskt separerande objekt för partiklar baserat på deras storlek och/eller form;avdragsanordning, filter, mekaniskt filter, luftfilter, raka, rensgaller, sandfilter, skrapgaller, vattenfilter, ventilationsfilter
Grundfunktioner och Komponenter;HQB;Skimmer;mekaniskt separerande objekt för olja genom skimmning;oljeskimmer
Grundfunktioner och Komponenter;HR;Elektriskt eller magnetiskt separerande objekt;materialbehandlande objekt genom elektromagnetisk separation av blandande substanser;
Grundfunktioner och Komponenter;HRA;Elektrostatfilter;elektriskt eller magnetiskt separerande objekt genom ett elektriskt fält;
Grundfunktioner och Komponenter;HRB;Magnetisk separator;elektriskt eller magnetiskt separerande objekt genom ett magnetiskt fält;
Grundfunktioner och Komponenter;HS;Kemiskt separerande objekt;materialbehandlande objekt genom kemiska separation av blandade substanser;
Grundfunktioner och Komponenter;HSA;Jonbytare;kemiskt separerande objekt genom utbyte av joner;
Grundfunktioner och Komponenter;HSB;Absorbent;kemiskt separerande objekt genom absorption;
Grundfunktioner och Komponenter;HSC;Adsorbent;kemiskt separerande objekt som binder substanser;
Grundfunktioner och Komponenter;HU;Mekaniskt sönderdelande objekt;materialbehandlande objekt som åstadkommer mindre former av solida material;
Grundfunktioner och Komponenter;HUA;Hackmaskin;mekaniskt sönderdelande objekt för mjukt, medelhårt, fibröst och segt material;avfallskvarn, livsmedelskvarn, köttkvarn, snabbhack
Grundfunktioner och Komponenter;HUB;Kvarn;mekaniskt sönderdelande objekt för bearbetning till specifika storlekar och former;livsmedelssåg, skärmaskin, såg, köttsåg
Grundfunktioner och Komponenter;HUC;Kross;mekaniskt sönderdelande objekt för mineral;bergkross
Grundfunktioner och Komponenter;HV;Aggregerande objekt;materialbehandlande objekt som åstadkommer större former av substanser;
Grundfunktioner och Komponenter;HVA;Pelletterare;aggregerande objekt som komprimerar eller formar material till pelletform;
Grundfunktioner och Komponenter;HVB;Kolloidator;aggregerande objekt som möjliggör (en process där) kolloidbildning från en vätska;förtjockare
Grundfunktioner och Komponenter;HW;Blandande objekt;materialbehandlande objekt som åstadkommer nya material genom att blanda olika substanser;
Grundfunktioner och Komponenter;HWA;Mixer;blandande objekt som åstadkommer en ny egenskap hos en substans från olika substanser;blandningsmaskin, glassmaskin, omrörare, vispmaskin, kaffebryggare, espressomaskin, kaffemaskin
Grundfunktioner och Komponenter;HWB;Befuktare;blandande objekt som åstadkommer fuktad gas;luftfuktare
Grundfunktioner och Komponenter;HX;Reagerande objekt;materialbehandlande objekt som åstadkommer nya material genom kemisk eller biologisk reaktion;
Grundfunktioner och Komponenter;HXA;Kemisk reaktor;reagerande objekt som åstadkommer och kontrollerar en kemisk reaktion;avsaltningsfilter, avhärdningsfilter, gasifierare
Grundfunktioner och Komponenter;HXB;Biologisk reaktor;reagerande objekt som åstadkommer och kontrollerar en biologisk reaktion;fermenterare, jäsmaskin
Grundfunktioner och Komponenter;K;Informationsbehandlande objekt;objekt för behandling av insignaler i syfte att avge lämpligt output;
Grundfunktioner och Komponenter;KB;Elektriskt signalkommunicerande objekt;informationsbehandlande objekt för kommunikation av elektriska signaler;
Grundfunktioner och Komponenter;KBA;Kommunikationsenhet;elektrisk signalbehandlande objekt utan mänsklig intervention för input/output till utrustning;adressenhet, I/O-modul, larmsändare, nätverkskort, USB-kort, Firewire-kort
Grundfunktioner och Komponenter;KE;Elektrisk signaldistribuerande objekt;signalbehandlande objekt för vidarebefordran av elektriska signaler; signalfördelande
Grundfunktioner och Komponenter;KEA;Relä;elektrisk signalfördelande objekt som vidarebefordrar elektriska signaler utan fördröjning;effektrelä, frekvensrelä, hjälprelä, impedansrelä, signalrelä, strömrelä, spänningsrelä, tidsrelä
Grundfunktioner och Komponenter;KEB;Nätverksbrygga;elektrisk signalfördelande objekt som överbryggar flera nätverkssegment;
Grundfunktioner och Komponenter;KEC;Router;elektrisk signalbehandlande objekt utan mänsklig intervention för vidarebefordran av signaler mellan datanätverk;brandvägg, gateway, modem
Grundfunktioner och Komponenter;KED;Switch;elektrisk signalfördelande objekt som vidarebefordrar signaler till specifik utrustning i ett datanät;
Grundfunktioner och Komponenter;KF;Elektrisk signalbehandlande objekt;informationsbehandlande objekt för behandling av elektriska signaler;
Grundfunktioner och Komponenter;KFA;Dator;elektrisk signalbehandlande objekt med mänsklig intervention;brandförsvarstablå, datorplatta, kodare, laptop, läsplatta, pc, protokollkonverterare, översättare
Grundfunktioner och Komponenter;KFB;Styr- och regleringsenhet;elektrisk signalbehandlande objekt utan mänsklig intervention för kontroll av utrustning;RTU, brandlarmscentral, centralapparat, DUC, kontrollapparat, larmlagringstablå, PLC, reglercentral, signalsäkerhetsställverk, styrapparat, styrenhet, telefonväxel, utestation, videoväxel
Grundfunktioner och Komponenter;KFC;Server;elektrisk signalbehandlande objekt utan mänsklig intervention;
Grundfunktioner och Komponenter;KG;Optisk signalbehandlande objekt;signalbehandlande objekt för optiska signaler;
Grundfunktioner och Komponenter;KGA;Optisk omkopplare;optisk signalbehandlande objekt som aktivt vidarebefordrar input till specifika apparater i ett optiskt nätverk;optisk switch
Grundfunktioner och Komponenter;KGB;Optisk router;optisk signalbehandlande objekt som vidarebefordrar datapaket mellan datornätverk;
Grundfunktioner och Komponenter;KGC;Optisk repeater;optisk signalbehandlande objekt som repeterar insignalen som en förbättrad utsignal;optisk förstärkare
Grundfunktioner och Komponenter;KH;Fluidsignalbehandlande objekt;signalbehandlande objekt för flödessignaler;hydrauliska och pneumatiksa signaler
Grundfunktioner och Komponenter;KHA;Regulator;flödessignalbehandlande objekt för återkopplande kontroll;
Grundfunktioner och Komponenter;KHB;Pilotventil;flödessignalbehandlande objekt som vidareförmedlar signaler;
Grundfunktioner och Komponenter;KJ;Mekanisk signalbehandlande objekt;signalbehandlande objekt för mekaniska signaler;
Grundfunktioner och Komponenter;KJA;Mekanisk regulator;mekanisk signalbehandlande objekt som justerar ett gas- eller vätskeflöde;
Grundfunktioner och Komponenter;KJB;Låscylinder;mekanisk signalbehandlande objekt som låser/låser upp en låsmekanism;
Grundfunktioner och Komponenter;KJC;Kodlås;mekanisk signalbehandlande objekt som åstadkommer ett binärt tillstånd hos en mekanism;handtagskodlås
Grundfunktioner och Komponenter;KZ;Multipel signalfördelande objekt;signalbehandlande objekt av multipla typer av signaler;
Grundfunktioner och Komponenter;KZA;Multiswitch;multipel signalbehandlande objekt som vidarebefordrar input till specifika apparater;
Grundfunktioner och Komponenter;M;Drivande objekt;objekt för tillhandhållande av mekanisk rörelse eller kraft;
Grundfunktioner och Komponenter;MA;Elektromagnetiskt rotationsdrivande objekt;drivande objekt genom rotationskraft driven av elektromagnetisk kraft;
Grundfunktioner och Komponenter;MAA;Elmotor;elektromagnetiskt rotationsdrivande objekt som åstadkommer en kontinuerlig rotation;driv, ställdon
Grundfunktioner och Komponenter;MAB;Stegmotor;elektromagnetiskt rotationsdrivande objekt som åstadkommer diskreta rotationssteg;
Grundfunktioner och Komponenter;MB;Elektromagnetiskt linjärt drivande objekt;drivande objekt genom linjär kraft, driven av elektromagnetisk kraft;
Grundfunktioner och Komponenter;MBA;Linjär motor;elektromagnetiskt linjärt drivande objekt som åstadkommer kontinuerlig rörelse;
Grundfunktioner och Komponenter;MBB;Solenoid;elektromagnetiskt linjärt drivande objekt som åstadkommer diskreta linjära steg;aktuator, elektromagnet, växeldriv
Grundfunktioner och Komponenter;MC;Magnetiskt drivande objekt;drivande objekt genom magnetisk kraft;
Grundfunktioner och Komponenter;MCA;Permanentmagnet;magnetiskt drivande objekt genom permanentmagnet;
Grundfunktioner och Komponenter;MD;Piezoelektriskt drivande objekt;drivande objekt genom piezoelektrisk effekt;
Grundfunktioner och Komponenter;MDA;Piezoelektrisk motor;piezoelektriskt drivande objekt genom piezoelektrisk kristall;piezoelektrisk aktuator
Grundfunktioner och Komponenter;ML;Mekaniskt kraftdrivande objekt;drivande objekt genom mekanisk energi;
Grundfunktioner och Komponenter;MLA;Gravitationsdrivare;mekaniskt kraftdrivande objekt genom frisläppande av gravitationsenergi;
Grundfunktioner och Komponenter;MLB;Elastisk drivare;mekaniskt kraftdrivande objekt genom frisläppande av elastisk energi;omläggningsanordning
Grundfunktioner och Komponenter;MLC;Vindturbin;mekaniskt kraftdrivande objekt genom kinetisk energi i blåst;
Grundfunktioner och Komponenter;MLD;Vattenturbin;mekaniskt kraftdrivande objekt genom kinetisk energi i strömmande vatten;
Grundfunktioner och Komponenter;MLE;Gasturbin;mekaniskt kraftdrivande objekt genom kinetisk energi och reaktiv kraft i strömmande och/eller expanderande gas;
Grundfunktioner och Komponenter;MM;Flödesdrivet drivande objekt;drivande objekt genom fluidförflyttning eller fluidtryck;
Grundfunktioner och Komponenter;MMA;Hydraulcylinder;flödesdrivande objekt som åstadkommer rörelse motsvarande en vätskevolym;lyftcylinder
Grundfunktioner och Komponenter;MMB;Pneumatisk cylinder;flödesdrivande objekt som åstadkommer rörelse till ändpositioner beroende på gastryck;
Grundfunktioner och Komponenter;MMC;Hydraulmotor;flödesdrivande objekt som åstadkommer rotation genom en strömmande vätska;
Grundfunktioner och Komponenter;MMD;Pneumatisk motor;flödesdrivande objekt som åstadkommer rotation genom trycksatt gas;
Grundfunktioner och Komponenter;MS;Förbränningsmotor;drivande objekt genom bränsleförbränning;
Grundfunktioner och Komponenter;MSA;Ottomotor;förbränningsmotor med kolvar som kraftsätts av gnistantänd förbränning;tändstiftsmotor
Grundfunktioner och Komponenter;MSB;Dieselmotor;förbränningsmotor med kolvar som kraftsätts av kompressionsantänd förbränning;
Grundfunktioner och Komponenter;MSC;Wankelmotor;förbränningsmotor med excentriskt roterade kolv i en cirkulär omslutning kraftsatt  av gnistantänd förbränning;
Grundfunktioner och Komponenter;MT;Värmemotor;drivande objekt genom extern värmekälla;
Grundfunktioner och Komponenter;MTA;Ångmaskin;värmemotor genom expanderande ånga som verkar på en kolv;ångturbin
Grundfunktioner och Komponenter;MTB;Stirlingmotor;värmemotor genom två kolvar i en cylinder med en upphettad och en kyld del;
Grundfunktioner och Komponenter;N;Täckande objekt;objekt för delvis eller hel omslutning av ett annat objekt;
Grundfunktioner och Komponenter;NA;Öppningsfyllande objekt;täckande objekt som fyller en öppning;
Grundfunktioner och Komponenter;NAA;Glasruta;öppningsfyllande objekt som tillåter ljusgenomsläpp;fönsterruta
Grundfunktioner och Komponenter;NAB;Panel;öppningsfyllande objekt som förhindrar ljusgenomsläpp;dörrspegel, inbrädning, plankpanel, råspont, yttertakspanel, underlagstak
Grundfunktioner och Komponenter;NAC;Galler;öppningsfyllande objekt som tillåter fluidgenomsläpp;avluftsgaller, brunnsgaller, fönstergaller, luftbrunn, ränngaller, uteluftsgaller, överluftsgaller
Grundfunktioner och Komponenter;NAD;Fogmaterial;öppningsfyllande objekt som förhindrar fluidgenomsläpp;cellgummi av neoprenkvalitet, dilatationsfog, fog, fogband, fogmassa, o-ring, packning, svällist
Grundfunktioner och Komponenter;NC;Beklädnadsobjekt;täckande objekt genom att avsluta konstruktioner;
Grundfunktioner och Komponenter;NCA;Markbeläggning;beklädnadsobjekt för hårdgjord yta;beläggning, gatubeläggning, markgaller, slitlager, vägbeläggning, vägplatta
Grundfunktioner och Komponenter;NCB;Väggbeklädnad;beklädnadsobjekt för vägg;betonglining, fasadbeklädnad, tunnelbeklädnad, panel, pelarinklädnad, väggpanel, väggskiva
Grundfunktioner och Komponenter;NCC;Golvbeläggning;beklädnadsobjekt för golv;golvmaterial, golvskiva, slätspont, undergolv
Grundfunktioner och Komponenter;NCD;Innertaksbeklädnad;beklädnadsobjekt för innertak;undertak
Grundfunktioner och Komponenter;NCE;Yttertaksbeklädnad;beklädnadsobjekt för yttertak;takbeklädnad, takmaterial, taktäckning
Grundfunktioner och Komponenter;NCF;Växtmatta;beklädnadsobjekt för vegetationsyta;grästorv, grässådd, sedummatta, sprutsådd, vegetationsmatta
Grundfunktioner och Komponenter;NCG;Smygbräda;beklädnadsobjekt i en öppning;dörrsmyg, fönsterbräda, fönsterbänk, fönstersmyg
Grundfunktioner och Komponenter;ND;Avslutande objekt;täckande objekt som avslutar andra objekt;
Grundfunktioner och Komponenter;NDA;Kantstöd;avslutande objekt för hårdgjord yta eller vegetationsyta;kantsten
Grundfunktioner och Komponenter;NDB;Krön;avslutande objekt för ett krön;avtäckning, kapitäl, krönbalk, krönlist, skorstenstäckning, topplåt, överliggare
Grundfunktioner och Komponenter;NDC;Golvsarg;avslutande objekt för en upphöjd golvkant;
Grundfunktioner och Komponenter;NDD;Innertaksavslutning;avslutande objekt för en innertakskant;
Grundfunktioner och Komponenter;NDE;Takavslutning;avslutande objekt för en yttertakskant;vattbräda, vindskiva, fotbräda
Grundfunktioner och Komponenter;NE;Döljande objekt;täckande objekt för fogar eller övergångar;
Grundfunktioner och Komponenter;NEA;Taklist;döljande objekt mellan en vägg och ett innertak;
Grundfunktioner och Komponenter;NEB;Golvsockel;döljande objekt mellan en vägg och ett golv;golvlist
Grundfunktioner och Komponenter;NEC;Hörnlist;döljande objekt mellan två väggar;knutbräda
Grundfunktioner och Komponenter;NED;Takbleck;döljande objekt på ett tak;gavelbeslag, nockbräda, nockpanna, nockplåt, ståndskiva, takfotsbeslag, underbleck, vinkelränna, överbleck
Grundfunktioner och Komponenter;NEE;Foder;döljande objekt runt en öppning;dörrfoder, dörrtryckesbricka, fönsterfoder, nyckelhålsbricka, täckbricka
Grundfunktioner och Komponenter;NEF;Täcklist;döljande objekt för en fog i parallella plan;
Grundfunktioner och Komponenter;P;Presenterande objekt;objekt för tillhandahållande av förnimbar information;
Grundfunktioner och Komponenter;PF;Visuell tillståndsindikator;presenterande objekt i synlig form av tillstånd eller läge;
Grundfunktioner och Komponenter;PFA;Signallampa;visuell tillståndsindikator genom ljus;avstängningssignal, blinkljus, blixtljus, bomlykta, brolampa, felindikeringstablå, gul varningssignal, körfältsignal (mcs), ljussignal, närvaroenhet, optiskt larmdon, roterande ljus, sjötrafiksignal, trafiksignal
Grundfunktioner och Komponenter;PFB;Semafor;visuell tillståndsindikator genom mekaniska positioner;kontrollanordning
Grundfunktioner och Komponenter;PG;Mätvärdesvisande objekt;presenterande objekt i synlig form av mätvärde;
Grundfunktioner och Komponenter;PGA;Spänningsvisare;mätvärdesvisande objekt för elektrisk spänning;
Grundfunktioner och Komponenter;PGB;Motståndsvisare;mätvärdesvisande objekt för motstånd eller ledningsförmåga;
Grundfunktioner och Komponenter;PGC;Strömstyrkevisare;mätvärdesvisande objekt för elektrisk ström;
Grundfunktioner och Komponenter;PGD;Densitetsvisare;mätvärdesvisande objekt för densitet;
Grundfunktioner och Komponenter;PGE;Fältvisare;mätvärdesvisande objekt för fält;
Grundfunktioner och Komponenter;PGF;Flödesvisare;mätvärdesvisande objekt för flöden;
Grundfunktioner och Komponenter;PGG;Dimensionsvisare;mätvärdesvisande objekt för rumslig dimension och/eller lägen;vinkelvisare, positionsvisare
Grundfunktioner och Komponenter;PGH;Energivisare;mätvärdesvisande objekt för energi;
Grundfunktioner och Komponenter;PGJ;Effektvisare;mätvärdesvisande objekt för elektrisk kraft;wattmätare
Grundfunktioner och Komponenter;PGK;Tidvisare;mätvärdesvisande objekt för tid;klocka, ur
Grundfunktioner och Komponenter;PGL;Nivåindikator;mätvärdesvisande objekt för nivå;
Grundfunktioner och Komponenter;PGM;Fuktighetsvisare;mätvärdesvisande objekt för fuktighet;hygrometer
Grundfunktioner och Komponenter;PGP;Tryckvisare;mätvärdesvisande objekt för tryck;
Grundfunktioner och Komponenter;PGQ;Koncentrationsvisare;mätvärdesvisande objekt för substanskoncentration;siktvisare
Grundfunktioner och Komponenter;PGR;Strålningsvisare;mätvärdesvisande objekt för strålning;
Grundfunktioner och Komponenter;PGS;Tempovisare;mätvärdesvisande objekt för tempo;varvräknare
Grundfunktioner och Komponenter;PGT;Temperaturvisare;mätvärdesvisande objekt för temperatur;
Grundfunktioner och Komponenter;PGV;Effektfaktorvisare;mätvärdesvisande objekt för sklllnaden mellan aktiv och reaktiv kraft;cos-phi-visare
Grundfunktioner och Komponenter;PGW;Kraftvisare;mätvärdesvisande objekt för vikt, kraft eller vridmoment;
Grundfunktioner och Komponenter;PGX;Ljudvisare;mätvärdesvisande objekt för ljud;
Grundfunktioner och Komponenter;PGZ;Händelsevisare;mätvärdesvisande objekt för antal händelser;
Grundfunktioner och Komponenter;PH;Grafiskt presenterande objekt;presenterande objekt i synlig form av bild, symboler eller text;
Grundfunktioner och Komponenter;PHA;Bildskärm;grafisk display dynamiskt på sin yta;display, dynamisk skylt, expeditionsenhet, korridordisplay, monitor, omställbar skylt, variabel skylt, krittavla, svart tavla, whiteboard
Grundfunktioner och Komponenter;PHB;Projektor;grafisk display dynamiskt på vald yta;
Grundfunktioner och Komponenter;PHC;Printer;grafisk display på tryckt media;kopiator, kopieringsmaskin, skrivare
Grundfunktioner och Komponenter;PHD;Skylt;grafisk display statiskt på ytan av ett objekt;distansskylt, etikett, märkskylt, namnskylt, orienteringsskylt, orienteringstavla, referensbeteckning, skylttavla, trafikmärke, vägmärke, vägvisning
Grundfunktioner och Komponenter;PHE;Markering;grafisk display statiskt på ytan av ett annat objekt;längsgående vägmarkering, markering för idrott och lek, markmålning, kattöga, tvärgående vägmarkering, vägbanereflektor, vägmarkering, ytmarkering, övergångsställe
Grundfunktioner och Komponenter;PHF;Markeringsstolpe;grafisk display genom sin fysiska karaktär;avvägningsdubb, boj, distanspåle, kabelmarkeringspåle, kantstolpe, kardinalprick, lateralprick, loddubb, markeringsstolpe, mätdubb, pollare, prick, referenspunkt, ruskprick, sjömärke
Grundfunktioner och Komponenter;PJ;Ljudsignalerande objekt;presenterande objekt i hörbar form;
Grundfunktioner och Komponenter;PJA;Högtalare;ljudsignalerande objekt genom membranrörelse;
Grundfunktioner och Komponenter;PJB;Akustiskt larmdon;ljudsignalerande objekt genom luftström;hesa fredrik, mistlur, siren, sirén, starktonssirén, tyfon
Grundfunktioner och Komponenter;PJC;Ringklocka;ljudsignalerande objekt genom mekanisk excitation;summer
Grundfunktioner och Komponenter;PK;Taktilt signalerande objekt;presenterande objekt i taktil form;
Grundfunktioner och Komponenter;PKA;Vibrator;taktilt signalerande objekt av diskreta tillstånd genom vibration;
Grundfunktioner och Komponenter;PKB;Taktil markering;taktilt signalerande objekt av statisk information;bullerremsa, bullerräffla, ledstråk, teckensrpåksskylt
Grundfunktioner och Komponenter;PKC;Frihöjdvarning;taktilt signalerande objekt för överliggande hinder;
Grundfunktioner och Komponenter;PL;Utsmyckande objekt;presenterande objekt för utsmyckande eller konstnärliga syften;
Grundfunktioner och Komponenter;PLA;Gesims;utsmyckande objekt som separation mellan två områden;kornisch
Grundfunktioner och Komponenter;PLB;Skulptur;utsmyckande objekt som rumslig representation av något;konstverk
Grundfunktioner och Komponenter;PLC;Fris;utsmyckande objekt som utskjutande figurer och/eller dekorativa element på en vägg;engagerad kolonn, halvkolonn, pilaster, stuckatur
Grundfunktioner och Komponenter;PLD;Bild;utsmyckande objekt som representerar, illustrerar eller reproducerar något på en yta;konstverk, tavla, muralmålning
Grundfunktioner och Komponenter;PLE;Prydnadsmatta;utsmyckande objekt genom en textil som täcker del av ett annat objekt;väggtextil, överkast
Grundfunktioner och Komponenter;PZ;Multipelt presenterande objekt;presenterande objekt i multipla former;
Grundfunktioner och Komponenter;PZA;Audiovisuellt alarm;multipelt presenterande objekt för diskreta tillstånd;
Grundfunktioner och Komponenter;PZB;TV-apparat;multipelt presenterande objekt för multipel information;bildskärm med högtalare, tv-mottagare
Grundfunktioner och Komponenter;PZC;Interaktiv terminal;multipel presenterande objekt med interaktiv funktion;Prator
Grundfunktioner och Komponenter;Q;Styrande objekt;objekt för öppning/stängning och styrning av tillträde eller flöde;
Grundfunktioner och Komponenter;QA;Elbrytande objekt;styrandeobjekt för elektrisk ström i en elektrisk krets;effektbrytare, kontaktor, startkopplare, effekttransistor, tyristor
Grundfunktioner och Komponenter;QAA;Strömkretsbrytare;elbrytande objekt mekaniskt under normala eller onormala förhållanden;isolerkopplad effektbrytare (mccb), effektbrytare, lastbrytare, linjetest AGP, luftbrytare, låskolvskontakt, magnetisk luftbrytare, mikrobrytare, mjukstartare, motorskyddsbrytare, nödstopp, provbrytare, polkopplare, spanjolettkontakt, startkopplare, stjärntriangelkoppling, stoppdon, strömbrytare, strömställare, tryckluftbrytare, vakuumbrytare, återställningsapparat
Grundfunktioner och Komponenter;QAB;Kontaktor;elbrytande objekt mekaniskt under normala förhållanden enbart;aktor (knx), högspänningskontaktor, lågspänningskontaktor
Grundfunktioner och Komponenter;QAC;Elektronisk strömbrytare;elbrytande objekt elektroniskt ;eltermostat, omkopplare för styrkrets, termostat
Grundfunktioner och Komponenter;QB;Elseparerande objekt;styrande objekt genom att separera elektriska kretsar;frånskiljare, säkringslastbrytare, säkringslastfrånskiljare
Grundfunktioner och Komponenter;QBA;Frånskiljare;elseparerande objekt genom mekanisk isolering av nedströms krets endast från uppströms krets;arbetsbrytare, säkerhetsbrytare, lastfrånskiljare
Grundfunktioner och Komponenter;QBB;Säkringslastfrånskiljare;elseparerande objekt genom mekanisk isolering av nedströms krets endast från uppströms krets och med inbyggd säkring;
Grundfunktioner och Komponenter;QBC;Isolerskarv;elseparerande objekt med mekanisk ihopfogning;
Grundfunktioner och Komponenter;QC;Jordande objekt;styrande objekt genom att jorda elektriska kretsar;jordningskopplare
Grundfunktioner och Komponenter;QCA;Jordningskopplare;jordande objekt som kopplar elektrisk krets till jord;jordkoppling, jordslutare
Grundfunktioner och Komponenter;QM;Styrande objekt av slutet fluidflöde;styrande objekt av fluidflöde av/på i sluten omslutning;manuella ventiler och spjäll
