;TrV;Benämning;Definition;Synonym
Grundfunktioner och Komponenter;QMA;Vätskeventil;styrande objekt av slutet fluidflöde för vätska;armatur, avstängningsventil, avtappningsanordning, bidéblandare, blandare, duscharmatur, duschblandare, drickfontän, handfatsblandare, kulventil, köksblandare, magnetventil, propp, sargblandare, tappkran, tappventil, termostatblandare, tvättställsblandare, tömningsventil, utkastare, vattenblandare, vattenfallsblandare, vattenkran, vattenuttag
Grundfunktioner och Komponenter;QMB;Gasventil;styrande objekt av slutet fluidflöde för gas;avluftare, luftventil, propp, ventil
Grundfunktioner och Komponenter;QN;Reglerande objekt av slutet fluidflöde;styrande objekt för variation av fluidflöde i sluten omslutning;ventiler och spjäll med ställdon
Grundfunktioner och Komponenter;QNA;Reglerventil för vätska;reglerande objekt av slutet fluidflöde för vätska;shunt, shuntventil, styrventil
Grundfunktioner och Komponenter;QNB;Reglerventil för gas;reglerande objekt av slutet fluidflöde för gas;gasregulator, irisspjäll, jalusispjäll, konstantflödesdon, spjäll, trottelventil
Grundfunktioner och Komponenter;QP;Styrande objekt av öppet vätskeflöde;styrande objekt för vätskeflöde i öppen omslutning;
Grundfunktioner och Komponenter;QPA;Dammlucka;kontrollerande objekt av öppet vätskeflöde;slussport
Grundfunktioner och Komponenter;QQ;Objekt för tillträde till utrymme;styrande objekt för tillträde till utrymme;
Grundfunktioner och Komponenter;QQA;Fönster;objekt för tillträde till utrymme för enbart ljus;dreh-kippfönster, fast fönster, franskt fönster, glidhängt fönster, kipp-drehfönster, lanternin, pivotfönster, skjutfönster, slagfönster, takljuskupol, tvåvägsfönster, vippfönster, vridfönster
Grundfunktioner och Komponenter;QQB;Glasparti;objekt för tillträde till utrymme för ljus och personer;fönsterparti
Grundfunktioner och Komponenter;QQC;Dörr;objekt för tillträde till utrymme för personer;fönsterdörr, innerdörr, jalusidörr, karuselldörr, roterande dörr, skjutdörr, slagdörr, vikdörr, ytterdörr
Grundfunktioner och Komponenter;QQD;Lucka;mindre objekt för tillträde till utrymme för inspektion eller för överföring av objekt;brunnslock, inspektionslucka, hundlucka, kattlucka, nedkastlucka, renslucka, soplucka, taklucka, tvättlucka, uppstigningslucka, vädringslucka
Grundfunktioner och Komponenter;QQE;Port;större objekt för tillträde till utrymme för överföring av objekt;garageport,  hangarport, rullgaller, rulljalusi, rullport, skjutport, slagport, takskjutport, vikport, vipport
Grundfunktioner och Komponenter;QQG;Spårspärr;objekt för tillträde till utrymme genom blockering av tillträde till spår;spårspärrklots
Grundfunktioner och Komponenter;QR;Styrande objekt av godsflöde;styrande objekt för flöde av gods;
Grundfunktioner och Komponenter;QRA;Roterande kammare;reglerande objekt av godsflöde med roterande kammare;doseringsmaskin, roterande godstömning, rörpostväxel, rörväxel
Grundfunktioner och Komponenter;QRB;Irisventil;reglerande objekt av godsflöde med irisöppning;doseringsmaskin
Grundfunktioner och Komponenter;QRC;Klaffventil;reglerande objekt av godsflöde med ledad lucka eller skiva;doseringsmaskin
Grundfunktioner och Komponenter;QS;Styrande objekt för mekanisk rörelse;styrande objekt för mekanisk rörelse;
Grundfunktioner och Komponenter;QSA;Lås;kontrollerande objekt för mekanisk rörelse genom blockering;elektriskt lås, ellås, eltryckeslås, elslutbleck, grindlås, magnetlås, motorlås, låsregel, regel, rälsvandringshinder, rälsvandringslås, spanjolett, hänglås, klykväxellås, lås- och kontrollanordning, låsanordning, låshus, växeltunglås
Grundfunktioner och Komponenter;QSB;Spårväxel;kontrollerande objekt för mekanisk rörelse genom växling mellan olika spår;
Grundfunktioner och Komponenter;QZ;Multipelt styrande objekt;styrande objekt i elektriska kretsar med olika metoder;
Grundfunktioner och Komponenter;QZA;Jordbrytare;multipelt styrande objekt för jordning eller separering;
Grundfunktioner och Komponenter;R;Begränsande objekt;objekt för begränsning eller stabilisering;
Grundfunktioner och Komponenter;RA;Elbegränsande objekt;begränsande objekt genom begränsning av elektriskt energiflöde;
Grundfunktioner och Komponenter;RAA;Diod;elbegränsande objekt genom blockering av ström i en riktning;
Grundfunktioner och Komponenter;RAB;Induktionsspole;elbegränsande objekt genom induktion i en krets;induktor, reaktor
Grundfunktioner och Komponenter;RAC;Motstånd;elbegränsande objekt genom motstånd i en krets;Provmotstånd
Grundfunktioner och Komponenter;RB;Elstabiliserande objekt;begränsande objekt genom stabilisering av elektriskt energiflöde;
Grundfunktioner och Komponenter;RBA;UPS;elstabiliserande objekt som garanterar kontinuerlig elkraftförsörjning;rectiverter
Grundfunktioner och Komponenter;RBB;Elkraftfilter;elstabiliserande objekt som undertrycker ett bestämt frekvensområde;
Grundfunktioner och Komponenter;RBC;Elkraftequalizer;elstabiliserande objekt som undertrycker eller förstärker multipla frekvensområden;
Grundfunktioner och Komponenter;RBD;Faskompensator;elstabiliserande objekt som tillhandhåller reaktiv kraft;
Grundfunktioner och Komponenter;RF;Signalstabiliserande objekt;begränsande objekt genom stabilisering av signal;
Grundfunktioner och Komponenter;RFA;Equalizer;signalstabiliserande objekt som undertrycker eller förstärker multipla frekvensområden;
Grundfunktioner och Komponenter;RFB;Signalfilter;signalstabiliserande objekt som undertrycker ett bestämt frekvensområde;filter
Grundfunktioner och Komponenter;RL;Rörelsebegränsande objekt;begränsande objekt genom begränsning av rörelse;
Grundfunktioner och Komponenter;RLA;Låskedja;rörelsebegränsande objekt genom begränsning av rörelser hos ett objekt;dörrkedja, säkerhetskedja
Grundfunktioner och Komponenter;RLB;Stötdämpare;rörelsebegränsande objekt genom avjämning och minskning av rörelser hos ett objekt;vibrationsdämpare
Grundfunktioner och Komponenter;RLC;Broms;rörelsebegränsande objekt genom hastighetsreducering och stoppande av ett annat objekt;rangerbroms
Grundfunktioner och Komponenter;RLD;Farthinder;rörelsebegränsande objekt genom att förhindra hög hastighet hos ett annat objekt;cykelfålla, gångfålla, refugelement, spårviddshinder, vägbula
Grundfunktioner och Komponenter;RM;Returflödesbegränsande objekt;begränsande objekt genom begränsning av returflöde av materia;
Grundfunktioner och Komponenter;RMA;Backventil;returflödesbegränsande objekt för vätska;återströmningsskydd
Grundfunktioner och Komponenter;RMB;Backspjäll;returflödesbegränsande objekt för gas;
Grundfunktioner och Komponenter;RMC;Backspärr;returflödesbegränsande objekt för solid materia;
Grundfunktioner och Komponenter;RME;Vattenlås;returflödesbegränsande objekt för lukt;luktfälla, odörfälla
Grundfunktioner och Komponenter;RN;Flödesbegränsande objekt;begränsande objekt genom begränsning av styrt flöde av materia;
Grundfunktioner och Komponenter;RNA;Flödesbegränsare;justerbart flödesbegränsande objekt för vätska;
Grundfunktioner och Komponenter;RNB;Luftdon;justerbart flödesbegränsande objekt för gas;frånluftsdon, friskluftsventil, frånluftsventil, krypgrundsventil, luftventil, tilluftsdon, tilluftsventil, uteluftsdon
Grundfunktioner och Komponenter;RNC;Flödesbegränsare för solid materia;justerbart flödesbegränsande objekt för solid materia;
Grundfunktioner och Komponenter;RND;Spridare;fast flödesbegränsande objekt för vätska;duschmunstycke, dysa, injusteringsventil, munstycke, perlator, reduceringsventil, sprinklerhuvud, sprinklermunstycke, styrventil, vattenspridare, venturidysa, venturimunstycke
Grundfunktioner och Komponenter;RQ;Lokalklimatstabiliserande objekt;begränsande objekt för den lokala omgivningen;
Grundfunktioner och Komponenter;RQA;Isolering;lokalklimatstabiliserande objekt som begränsar termisk eller ljudtransmission;frostisoleringslager, frostskyddsisolering, ljuddämpning, ljudisolering, termisk isolering, tjälskydd, ljudisolering, luftljudisolering, stegljudsisolering
Grundfunktioner och Komponenter;RQB;Stabiliserande lager;lokalklimatstabiliserande objekt som stabiliserar flöde av vätska, fukt, vind eller material;geoduk, geotextil, materialskiljande duk, materialskiljande lager, vindskyddspapp
Grundfunktioner och Komponenter;RQC;Bullerskydd;lokalklimatstabiliserande objekt som stabiliserar ljudutbredning;bullerplank, bullerskärm, ex-ljuddämpare, explosionsljuddämpare, ljudabsorbent, ljuddämpare
Grundfunktioner och Komponenter;RQD;Klimatskärm;lokalklimatstabiliserande objekt som begränsar vind, nederbörd eller strålning;markis, solskyddsfilm, solskärm, vindskydd
Grundfunktioner och Komponenter;RQE;Gardin;lokalklimatstabiliserande objekt som begränsar ljusflöde genom textil;draperi, förhänge, rullgardin
Grundfunktioner och Komponenter;RQF;Persienn;lokalklimatstabiliserande objekt som begränsar ljusflöde genom smala justerbara jalusier;fasadpersienn, invändig persienn
Grundfunktioner och Komponenter;RQG;Fönsterlucka;lokalklimatstabiliserande objekt som begränsar ljusflöde genom utvändig avskärmning;
Grundfunktioner och Komponenter;RQH;Ogrässkydd;lokalklimatstabiliserande objekt som förhindrar genomväxt av ogräs;
Grundfunktioner och Komponenter;RQJ;Skärmvägg;lokalklimatstabiliserande objekt som förhindrar genomsikt och som dämpar ljudöverföring;balkongskärm, duschvägg, insynsskydd, monter, sidoskärm
Grundfunktioner och Komponenter;RU;Tillträdesbegränsande objekt;begränsande objekt för tillträde;
Grundfunktioner och Komponenter;RUA;Barriär;tillträdesbegränsande objekt genom en horisontell långsträckt barriär med vertikal utsträckning;mur, parkeringsplanka, plank, p-planka, staket, stopplanka, stängsel, viltstängsel, vägskyddsportal 
Grundfunktioner och Komponenter;RUB;Flyttbar barriär;tillträdesbegränsande objekt genom flyttbart hinder;bom, vägspärr, gallergrind, rullgaller
Grundfunktioner och Komponenter;RUC;Roterande barriär;tillträdesbegränsande objekt genom en roterande barriär;karuselldörr, vändkors
Grundfunktioner och Komponenter;RUD;Pollare;tillträdesbegränsande objekt genom en barriär med begränsad horisontell och vertikal utsträckning;hinderpåle
Grundfunktioner och Komponenter;RUE;Väghinder;tillträdesbegränsande objekt genom utformning av rörelseväg;färist, råttspärr, pyramidgummimatta
Grundfunktioner och Komponenter;RUF;Näthinder;tillträdesbegränsande objekt genom ett nät;insektsnät, musnät, gnagarnät, fågelnät, gnagarskydd 
Grundfunktioner och Komponenter;S;DummyS;;
Grundfunktioner och Komponenter;SA;Manuellt interagerande objekt;Omvandla en manöver till en signal och/ eller förändring av rörelsenenegri;ljusknapp, belysningsknapp, brandlarmsknapp, funktionsnyckel, vippknapp, tangentbord, återfjädrande tryckknapp, börvärdessättare, trådlösmus, gong, dimmer, ratt, tryckknappsventil, nödstopp
Grundfunktioner och Komponenter;T;Transformerande objekt;objekt för transformering;
Grundfunktioner och Komponenter;TA;Eltransformerande objekt;transformerande objekt för elektrisk energi utan att ändra mellan likspänning och växelspänning;
Grundfunktioner och Komponenter;TAA;Transformator;eltransformerande objekt från AC till AC utan ändring av frekvensen;autotransformator, drivdon, isolertransformator, krafttransformator, oljeisolerad distributionstransformator, skyddstransformator, störskyddstransformator, sugtransformator, torrisolerad distributionstransformator, torrisolerad transformator, vridtransformator, vätskeisolerad transformator
Grundfunktioner och Komponenter;TAB;Likströmsomvandlare;eltransformerande objekt från DC till DC;
Grundfunktioner och Komponenter;TAC;Frekvensomvandlare;eltransformerande objekt från AC till AC med ändring av frekvensen;frekvensomformare, frekvensomriktare
Grundfunktioner och Komponenter;TAD;Fasomvandlare;eltransformerande objekt från AC till AC med förändring av vinkeln mellan spänning och strömstyrka;
Grundfunktioner och Komponenter;TB;Elkonverterande objekt;transformerande objekt för elektrisk energi mellan likspänning och växelspänning;
Grundfunktioner och Komponenter;TBA;Likriktare;elkonverterande objekt från AC till DC;
Grundfunktioner och Komponenter;TBB;Växelriktare;elkonverterande objekt från DC till AC;
Grundfunktioner och Komponenter;TBC;Dubbelriktad konverterare;elkonverterande objekt från AC till DC eller från DC till AC;konverter
Grundfunktioner och Komponenter;TC;Universalkraftaggregat;transformerande objekt för elektrisk energi från likspänning och växelspänning till likspänning eller växelspänning;
Grundfunktioner och Komponenter;TCA;Universalkraftaggregat för växelspänning;universalkraftaggregat för växelspänning;kraftaggregat, nätaggregat
Grundfunktioner och Komponenter;TCB;Universalkraftaggregat objekt för likspänning;universalkraftaggregat objekt för likspänning;kraftaggregat, nätaggregat, laddare
Grundfunktioner och Komponenter;TF;Signalkonverterande objekt;transformerande objekt för signal;
Grundfunktioner och Komponenter;TFA;Förstärkare;signalkonverterande objekt som bibehåller signalformen;repeater
Grundfunktioner och Komponenter;TFB;Antenn;signalkonverterande objekt mellan trådad och trådlös form;balis, fast antenn, hörslinga, kodad spårledning, parabolantenn
Grundfunktioner och Komponenter;TFC;Signalformerare;signalkonverterande objekt mellan trådade former;decoder, dekoder, dsp, mixer
Grundfunktioner och Komponenter;TFD;Optisk sändare/mottagare;signalkonverterande objekt mellan elektrisk och optisk form;mediakonverter, mediakonverterare
Grundfunktioner och Komponenter;TFE;Telefon;signalkonverterande objekt mellan ljudvågor och elektrisk signal;anropsapparat, bildtelefon, hisstelefon, larmtelefon, mobiltelefon, nödtelefon, porttelefon, radioapparat, radiomottagare, radiosändare, telefon, telefonapparat
Grundfunktioner och Komponenter;TL;Mekanisk energitransformerande objekt;transformerande objekt för mekanisk energi;
Grundfunktioner och Komponenter;TLA;Växel;mekanisk energitransformerande objekt för hastighet;kraftväxel, växel
Grundfunktioner och Komponenter;TLB;Vridmomentsreglerare;mekanisk energitransformerande objekt för vridmoment;
Grundfunktioner och Komponenter;TLC;Hävstång;mekanisk energitransformerande objekt för kraft;
Grundfunktioner och Komponenter;TM;Massreducerande objekt;transformerande objekt för form genom massreduktion;
Grundfunktioner och Komponenter;TMA;Borrmaskin;massreducerande objekt genom en mekanisk process;hålslagningsmaskin, slipmaskin, såg, vinkelslip
Grundfunktioner och Komponenter;TMB;Värmeskärare;massreducerande objekt genom en termisk process;gasskärare, gasskärmaskin, plasmaskärare
Grundfunktioner och Komponenter;TMC;Etsningsmaskin;massreducerande objekt genom en kemisk process;
Grundfunktioner och Komponenter;TP;Materialomformande objekt;transformerande objekt för form genom omformning;
Grundfunktioner och Komponenter;TPA;Smidesmaskin;materialomformande objekt genom smide;
Grundfunktioner och Komponenter;TPB;Extruderingsmaskin;materialomformande objekt genom extrudering;strängpress
Grundfunktioner och Komponenter;TPC;Sträckmaskin;materialomformande objekt genom sträckning;trådsträckmaskin
Grundfunktioner och Komponenter;TPD;Vals;materialomformande objekt genom valsning;lettringsmaskin, lättringsmaskin, mangel
Grundfunktioner och Komponenter;TPE;Bockningsmaskin;materialomformande objekt genom böjning;
Grundfunktioner och Komponenter;TPF;Elektromagnetisk formningsmaskin;materialomformande objekt genom högenergiapplicering;explosionsformningsmaskin
Grundfunktioner och Komponenter;TR;Växt;transformerande objekt för strålning genom fotosyntes;
Grundfunktioner och Komponenter;TRA;Träd;växt som har en vedartad huvudstam och som vanligen når en höjd av minst 5 m;barrträd, fruktträd, lövträd
Grundfunktioner och Komponenter;TRB;Buske;växt där den vedartade stammen vid markytan delas i flera jämnstarka stammar;barrbuske, buske, bärbuske, häckplanta, lövbuske, planta, prydnadsbuske, ros
Grundfunktioner och Komponenter;TRC;Klätterväxt;växt med långa, ofta veka skott, vilka med hjälp av klätterorgan tar sig upp i ljuset;klängväxt, lian, slingerväxt
Grundfunktioner och Komponenter;TRD;Ört;växt som inte alls eller endast obetydligt är förvedad;annuell, gräsplanta, knölväxt, lökväxt, perenn, pluggplanta
Grundfunktioner och Komponenter;U;Hållande objekt;objekt för positionering av andra objekt;
Grundfunktioner och Komponenter;UA;Positionerande objekt;hållande objekt genom stöd vid en bestämd position;
Grundfunktioner och Komponenter;UAA;Belysningsarmatur;positionerande objekt för ljuskällor;armatur, armaturränna, lampa, ljusarmatur
Grundfunktioner och Komponenter;UAB;Kabelgenomföring;positionerande objekt för kablar;
Grundfunktioner och Komponenter;UAC;Isolator;positionerande objekt för ledare;spännisolator, stagisolator
Grundfunktioner och Komponenter;UAD;Vangstycke;positionerande objekt för trappsteg;
Grundfunktioner och Komponenter;UAE;Beklädnadsfäste;positionerande objekt för täckande objekt;bärläkt, dubb, glespanel, nockbräda, putsnät, ströläkt, stödläkt, stödbalk
Grundfunktioner och Komponenter;UAF;Växtstöd;positionerande objekt för växt;pergola, spaljé, trädstöd
Grundfunktioner och Komponenter;UAG;Spårhållare;positionerande objekt för avstånd mellan räler;
Grundfunktioner och Komponenter;UAH;Klämma;positionerande objekt för verktyg eller arbetsstycke;
Grundfunktioner och Komponenter;UAJ;Cykelställ;positionerande objekt för fordon;
Grundfunktioner och Komponenter;UAK;Befästning;positionerande objekt för räl;
Grundfunktioner och Komponenter;UB;Uppbärande objekt;hållande objekt genom uppbärning eller stöd;
Grundfunktioner och Komponenter;UBA;Stödhylla;uppbärande objekt mellan diskreta positioner;
Grundfunktioner och Komponenter;UBB;Hängare;uppbärandeobjekt i en diskret punkt genom hängning;armaturkrona, brokabel, bärkabel, bärtråd, hängkedja, hängverk, kabelkedja, kedja, klädkrok, krokbräda, kätting, rännkrok, skyltbrygga, spännkedja, stolparm, tavellist, undertakspendel, undertaksprofil, undertaksväggskena, upphängningsvajer, utliggare, väggskena
Grundfunktioner och Komponenter;UBC;Trappsteg;uppbärandeobjekt i en diskret punkt genom steg;blocksteg, stegpinne
Grundfunktioner och Komponenter;UBD;Stolpe;uppbärandeobjekt i en diskret punkt genom lyftning;baluster, belysningsstolpe, flaggstång, konsol, kontaktledningsstolpe, kraftledningsstolpe, mast, stativ, stålbåge, ståndare, trappspindel, trappstock
Grundfunktioner och Komponenter;UBE;Bärmöbel;uppbärande objekt för viss nivå genom lyftning;arbetsbänk, bord, brits, bänk, bänkbord, bänkskiva, disk, divan, fåtölj, pall, parkbord, parkbänk, plattform, rastmöbel, receptionsdisk, serveringsdisk, soffa, stol, strykbord, strykbräda, ståbord, säng
Grundfunktioner och Komponenter;UBF;Portal;uppbärandeobjekt  genom två stolpar med förbindande horisontell överliggare;
Grundfunktioner och Komponenter;UC;Omslutande objekt;hållande objekt genom omslutning ;
Grundfunktioner och Komponenter;UCA;Apparatskåp;omslutande object för apparater;anslutningsdosa, apparatdosa, apparatlåda, dosa, elskåp, installationsskåp, kabelmätarskåp, kabelskåp, kapslad central, kopplingsbox, kopplingsdosa, mätarskåp, rack, tändplats, växelvärmeskåp
Grundfunktioner och Komponenter;UCB;Växtjord;omslutande object för växtrötter;
Grundfunktioner och Komponenter;UCC;Ventilationshuv;delvis omslutande object för punktventilation;draghuv, dragskåp, kökskåpa, renluftsbänk, spiskåpa, säkerhetsbänk, ventilerad förvaringsenhet
Grundfunktioner och Komponenter;UCD;Apparatbrunn;omslutande objekt för anordningar i mark eller golv;mätbrunn, ventilbrunn
Grundfunktioner och Komponenter;UE;Byggkonstruktivt objekt i mark;hållande objekt för grundläggning;
Grundfunktioner och Komponenter;UEA;Bärande skikt;markkonstruktivt objekt i form av ett liggande plan som överför för transversallaster till mark;bottenplatta, bärlager, fördelningsplatta, grundplatta, platta på mark, grundsula, ledningsbädd, skelettjord, spårballast, överballast
Grundfunktioner och Komponenter;UEB;Markfundament;byggnadskonstruktivt fundament stående långsträckt form som överför laster till marken;fundament, grundfundament, pelarholk, plint, påle
Grundfunktioner och Komponenter;UEC;Sliper;markkonstruktivt objekt i långsträckt form som överför transversallaster till mark;brosliper, linjesliper
Grundfunktioner och Komponenter;UED;Bindlager;markkonstruktivt objekt i form av ett liggande plan som tar upp skjuvkrafter;sättbruk, sättsand
Grundfunktioner och Komponenter;UF;Vertikalt byggkonstruktivt objekt;hållande objekt som formar strukturellt stöd i vertikal riktning;
Grundfunktioner och Komponenter;UFB;Pelare;vertikalt lastöverförande objekt i långsträckt form som överför axiella trycklaster vertikalt till andra strukturella objekt;baluster, fackverkspelare, kolonn, pylon, regel, skivpelare, stödben, stämp, mellanstöd
Grundfunktioner och Komponenter;UFC;Bärande stödmur;vertikalt lastöverförande objekt i form av ett stående plan som överför vertikala och transversala laster;frontmur, grusskifte, källarväggstomme, lagerpall, landfäste
Grundfunktioner och Komponenter;UFD;Väggkärna;vertikalt lastöverförande objekt i form av ett stående plan som överför enbart vertikala laster;grundmur, murverk, skiva, väggmur, väggregelverk, väggstomskiva, väggstomme
Grundfunktioner och Komponenter;UFE;Stödmur;vertikalt lastöverförande objekt i form av ett stående plan som överför transversala laster;kajmur, plåt på stålbågar, sekantpåle, slitsmur, spont, stenfylld nätkorg, trädgropsfundament, vingmur
Grundfunktioner och Komponenter;UG;Horisontellt byggkonstruktivt objekt;hållande objekt som formar strukturellt stöd i horisontell riktning;
Grundfunktioner och Komponenter;UGA;Balk;horisontellt byggkonstruktivt objekt i långsträckt form som överför primärt transversallaster till andra strukturella objekt;bumerangbalk, bärlina, fackverksbalk, grundbalk, hammarband, kantbalk, krökt balk, omvänd sadelbalk, pulpetbalk, rak balk, sadelbalk, syll, takstol, traversbalk, vierendeelbalk, votad balk
Grundfunktioner och Komponenter;UGB;Bärande platta;horisontellt byggkonstruktivt objekt i form av ett liggande plan som överför transversallaster till andra strukturella objekt;balkongplatta, bjälklagsplatta, brobaneplatta, fördelningsplatta, håldäckselement, loftgångsplatta, massivelelement, plattbärlag, påldäck, pålfundament, pålplint, pålplatta
Grundfunktioner och Komponenter;UGC;Stödplatta;horisontellt byggkonstruktivt objekt i form av en platta som fördelar last från ett överliggande till ett underliggande strukturellt objekt;bergsko, jordsko, lagerklack, maskinfundament, pålsko, stödklots, stödknap
Grundfunktioner och Komponenter;UGD;Konsol;horisontellt byggkonstruktivt objekt i form av en utkragning som överför transversallaster från ett överliggande objekt;brobanekonsol
Grundfunktioner och Komponenter;UH;Byggkonstruktivt stag;byggkonstruktivt hållande objekt i riktningsoberoende orientering;
Grundfunktioner och Komponenter;UHA;Dragstag;Byggkonstruktivt stag som överför axiella draglaster;bärkabel, snedsträva, spännstag, spännstål, stag, stång
Grundfunktioner och Komponenter;UHB;Tryckstag;Byggkonstruktivt stag som överför trycklaster;hammarband vid spontvägg, horisontellt tryckstag, kontrefort, strävpelare, stämp
Grundfunktioner och Komponenter;UJ;Byggkonstruktiv båge;byggkonstruktivt hållande objekt i böjd form;
Grundfunktioner och Komponenter;UJA;Bärande båge;byggkonstruktivt båge som överför transversallaster till axiella laster;båge, inslagsvalv, klostervalv, kryssribbvalv, kryssvalv, rörskärm, stickvalv, stjärnvalv, tunnvalv, valvplåt
Grundfunktioner och Komponenter;UJB;Brorör;byggkonstruktivt båge i form av ett rör med > 2 meter i diameter som överför last;
Grundfunktioner och Komponenter;UM;Förstärkande objekt;hållande objekt genom förstärkning ;
Grundfunktioner och Komponenter;UMA;Armeringsstång;förstärkande objekt i form av en inbäddad stång;armeringsjärn, bergbult, jordskruv, jordspik
Grundfunktioner och Komponenter;UMB;Armeringsnät;förstärkande objekt i form av inbäddat nät eller duk;armeringsduk, geotextil, jordarmeringsnät, kanalnät, nät
Grundfunktioner och Komponenter;UMC;Förstärkningslager;förstärkande objekt i form av ett masslager;rustbädd, underballast
Grundfunktioner och Komponenter;UMD;Injekterad massa;förstärkande objekt i form av inbäddat material;jetinjektering, kc-pelare, kompakteringsinjektering, mdm-pelare, masstabilisering, penetrationsinjektering, pliggpålning, stenpelare, ytstabilisering
Grundfunktioner och Komponenter;UME;Slutbleck;förstärkande objekt i form av ett slutbleck;
Grundfunktioner och Komponenter;UMF;Utspetsning;förstärkande objekt i form av en utspetsning;
Grundfunktioner och Komponenter;UMG;Vertikaldränering;förstärkande objekt i form av ett vertikalt dränerande skikt;
Grundfunktioner och Komponenter;UMH;Sprutbetong;förstärkande objekt i form av sprutbetong;
Grundfunktioner och Komponenter;UMJ;Betonglining;förstärkande objekt i form av betonglining;
Grundfunktioner och Komponenter;UMK;Avstyvning;förstärkande objekt i form av avstyvning;livavstyvning, kortling
Grundfunktioner och Komponenter;UML;Diagonal förbindning;förstärkande objekt i form av en diagonal förbindning;tvärbalk, tvärförband
Grundfunktioner och Komponenter;UMM;Förstärkningskabel;förstärkande objekt i form av kablar;kabel, staglina
